

###################

mysql> select users.first_name, users.last_name, friends.first_name, friends.last_name from users left join friendships on users.id = friendships.user_id left join users as friends on friendships.friend_id = friends.id;
+------------+-----------+------------+-----------+
| first_name | last_name | first_name | last_name |
+------------+-----------+------------+-----------+
| Amy        | Giver     | Eli        | Byers     |
| Amy        | Giver     | Big        | Bird      |
| Amy        | Giver     | Kermit     | The Frog  |
| Eli        | Byers     | Kermit     | The Frog  |
| Eli        | Byers     | Marky      | Mark      |
| Big        | Bird      | NULL       | NULL      |
| Kermit     | The Frog  | NULL       | NULL      |
| Marky      | Mark      | Big        | Bird      |
+------------+-----------+------------+-----------+
8 rows in set (0.00 sec)

################# 1

mysql> select users.first_name, users.last_name, friends.first_name, friends.last_name from users left join friendships on users.id = friendships.user_id left join users as friends on friendships.friend_id = friends.id where users.first_name = 'Kermit';

+------------+-----------+------------+-----------+
| first_name | last_name | first_name | last_name |
+------------+-----------+------------+-----------+
| Kermit     | The Frog  | NULL       | NULL      |
+------------+-----------+------------+-----------+


###################### 2 - 3


mysql> select users.first_name, users.last_name, count(friends.id) as number_friends from users left join friendships on users.id = friendships.user_id left join users as friends on friendships.friend_id = friends.id group by users.id order by number_friends desc;
+------------+-----------+----------------+
| first_name | last_name | number_friends |
+------------+-----------+----------------+
| Amy        | Giver     |              3 |
| Eli        | Byers     |              2 |
| Marky      | Mark      |              1 |
| Big        | Bird      |              0 |
| Kermit     | The Frog  |              0 |
+------------+-----------+----------------+
5 rows in set (0.00 sec)


###############################  4

mysql> insert into users (first_name,last_name,created_at) values ('juan carlos','bodoque',now());
Query OK, 1 row affected (0.00 sec);

mysql> insert into friendships (user_id, friend_id, created_at) values (6,1,now()), (6,4,now()), (6,5,now());

mysql> select users.first_name, users.last_name, friends.first_name, friends.last_name from users left join friendships on users.id = friendships.user_id left join users as friends on friendships.friend_id = friends.id where users.last_name = 'bodoque';
+-------------+-----------+------------+-----------+
| first_name  | last_name | first_name | last_name |
+-------------+-----------+------------+-----------+
| juan carlos | bodoque   | Amy        | Giver     |
| juan carlos | bodoque   | Kermit     | The Frog  |
| juan carlos | bodoque   | Marky      | Mark      |
+-------------+-----------+------------+-----------+


#################### 5

mysql> select users.first_name, users.last_name, friends.first_name, friends.last_name from users left join friendships on users.id = friendships.user_id left join users as friends on friendships.friend_id = friends.id where users.first_name = 'Eli' order by friends.first_name, friends.last_name asc;
+------------+-----------+------------+-----------+
| first_name | last_name | first_name | last_name |
+------------+-----------+------------+-----------+
| Eli        | Byers     | Kermit     | The Frog  |
| Eli        | Byers     | Marky      | Mark      |
+------------+-----------+------------+-----------+
2 rows in set (0.00 sec)


############### 6

mysql> delete from friendships where user_id = 2 and friend_id = 5;
Query OK, 1 row affected (0.00 sec)

+------------+-----------+------------+-----------+
| first_name | last_name | first_name | last_name |
+------------+-----------+------------+-----------+
| Eli        | Byers     | Kermit     | The Frog  |
+------------+-----------+------------+-----------+
1 row in set (0.00 sec)

############ 7



###################

mysql> select users.first_name, users.last_name, friends.first_name, friends.last_name from users left join friendships on users.id = friendships.user_id left join users as friends on friendships.friend_id = friends.id;
+------------+-----------+------------+-----------+
| first_name | last_name | first_name | last_name |
+------------+-----------+------------+-----------+
| Amy        | Giver     | Eli        | Byers     |
| Amy        | Giver     | Big        | Bird      |
| Amy        | Giver     | Kermit     | The Frog  |
| Eli        | Byers     | Kermit     | The Frog  |
| Eli        | Byers     | Marky      | Mark      |
| Big        | Bird      | NULL       | NULL      |
| Kermit     | The Frog  | NULL       | NULL      |
| Marky      | Mark      | Big        | Bird      |
+------------+-----------+------------+-----------+
8 rows in set (0.00 sec)

